{
 "schema": 2,
 "octave": "11.3.0",
 "producer": {
  "id": "octave-extra-content",
  "pin": "submodule:see-mail"
 },
 "note": "★ 样件（golden）：Pyodide 运行时 = 共享能力层（form=\"tree\"）。**这是 §2 判决的示例**：symbolic 不引入 needs 新字段，而是 deps 里指一条边到本条目。",
 "entries": [
  {
   "name": "pyodide",
   "version": "314.0.7",
   "form": "tree",
   "sha256": "2abdcc2e35208af406e07724cffa85bc582ced97e9028383ecf5462541393f95",
   "url": "assets/pyodide/pyodide-core-314.0.7.tar.bz2",
   "upstream_url": "https://github.com/pyodide/pyodide/releases/download/314.0.7/pyodide-core-314.0.7.tar.bz2",
   "size": 6757104,
   "content": [],
   "deps": [],
   "note": "符号计算的共享能力层；sympy/mpmath 轮子另有两件（见 recipes/pyodide.md）"
  }
 ]
}